{
  "schema_version": "paper_fill_sim_batch_oracle_sealed_day_incomplete_rpc_v0",
  "type": "paper_batch",
  "id": "paper-fill-sim-batch-oracle-sealed-day-incomplete-rpc-v0",
  "paper_only": true,
  "input": {
    "pipeline": [
      "sealed_observe_jsonl",
      "hot_packet_v0",
      "paper_evaluate_hot_packet_v0",
      "paper_fill_sim_hot_packet_evaluate_v0",
      "paper_fill_sim_scoreboard_sealed_fixture_v0"
    ],
    "local_json_only": true,
    "rpc": false,
    "observe_jsonl_tail": false,
    "host_extract_required": false,
    "host_jsonl_read": false,
    "fixture_origin": "synthetic",
    "graph_policy": "cold",
    "marks_joined": false,
    "days": [
      {
        "day": "2026-09-20",
        "jsonl_name": "observe-2026-09-20.jsonl",
        "source_rows": [
          {
            "schema_version": "observe_hot_v0",
            "type": "ingest_hot",
            "t_ws": "2026-09-20T12:00:00.000+00:00",
            "t_event": null,
            "stream": "subscribeNewToken",
            "source": "pumpportal_ws",
            "commitment": "processed",
            "stage": "bonding",
            "regime_id": "env=mainnet|source=pumpportal_ws|stream=subscribeNewToken|stage=bonding|quote=wsol_assumed|commitment=processed|venue=pump_program|instr=pending_rpc|fee=unverified|market=bonding_curve",
            "txType": "create",
            "signature": "SigSynth20Runner",
            "mint": "MintSynth20Runner",
            "knowable_at_t": {
              "quote": "wsol_assumed",
              "quote_verified": false,
              "instr": "pending_rpc",
              "fee": "unverified",
              "venue": "pump_program",
              "venue_verified": false,
              "creator_verified": false,
              "reserves_source": "ws"
            },
            "ws_payload": {
              "signature": "SigSynth20Runner",
              "mint": "MintSynth20Runner",
              "txType": "create",
              "traderPublicKey": "TraderSynth20",
              "name": "Synth20",
              "symbol": "S20",
              "initialBuy": 1.0,
              "solAmount": 0.01
            },
            "ws_fields_unknown": [],
            "traderPublicKey": "TraderSynth20",
            "name": "Synth20",
            "symbol": "S20",
            "uri": "https://example.invalid/synth20.json",
            "bondingCurveKey": "CurveSynth20",
            "initialBuy": 1.0,
            "solAmount": 0.01,
            "vTokensInBondingCurve": 1000000.0,
            "vSolInBondingCurve": 30.0,
            "marketCapSol": 30.0
          },
          {
            "schema_version": "observe_hot_v0",
            "type": "ingest_hot",
            "t_ws": "2026-09-20T12:00:01.000+00:00",
            "t_event": null,
            "stream": "subscribeNewToken",
            "source": "pumpportal_ws",
            "commitment": "processed",
            "stage": "bonding",
            "regime_id": "env=mainnet|source=pumpportal_ws|stream=subscribeNewToken|stage=bonding|quote=wsol_assumed|commitment=processed|venue=pump_program|instr=pending_rpc|fee=unverified|market=bonding_curve",
            "txType": "create",
            "signature": "SigSynth20Reject",
            "mint": "UNK",
            "knowable_at_t": {
              "quote": "wsol_assumed",
              "quote_verified": false,
              "instr": "pending_rpc",
              "fee": "unverified",
              "venue": "pump_program",
              "venue_verified": false,
              "creator_verified": false,
              "reserves_source": "ws"
            },
            "ws_payload": {
              "signature": "SigSynth20Reject",
              "mint": "UNK",
              "txType": "create"
            },
            "ws_fields_unknown": [],
            "traderPublicKey": "TraderSynth20Reject",
            "name": "Reject20",
            "symbol": "R20",
            "uri": null,
            "bondingCurveKey": null,
            "initialBuy": null,
            "solAmount": null,
            "vTokensInBondingCurve": null,
            "vSolInBondingCurve": null,
            "marketCapSol": null
          },
          {
            "schema_version": "observe_mark_v0",
            "type": "outcome_mark",
            "mint": "MintSynth20Runner",
            "parent_signature": "SigSynth20Runner",
            "t_mark": "2026-09-20T12:00:05.000+00:00",
            "source": "rpc_tx",
            "price_proxy": 1.25,
            "t_decision": "2026-09-20T12:00:00.000+00:00"
          }
        ],
        "expectation": {
          "schema_version": "paper_fill_sim_scoreboard_sealed_fixture_v0",
          "fixture_kind": "sealed_day_expectation",
          "origin": "synthetic",
          "day": "2026-09-20",
          "sealed_book_rpc_slice": "incomplete",
          "closed_book_claim": false,
          "horizon_join": {
            "status": "fixture_joined_null_explicit",
            "values_supplied": false,
            "null_is_not_zero_return": true
          },
          "delta_exec_join": {
            "field": "delta_exec",
            "also_called": "Δ_exec",
            "value": null,
            "status": "fixture_joined_null_explicit",
            "reason": "fill_sim_sealed_day_fixture_has_no_scored_fill",
            "null_is_not_zero_cost": true
          },
          "rows": [
            {
              "source_day": "2026-09-20",
              "signature": "SigSynth20Reject",
              "mint": "UNK",
              "evaluate_label": "reject",
              "fill_sim_status": "reject_arm_no_pretend_buy",
              "reasons": [
                "missing_mint"
              ]
            },
            {
              "source_day": "2026-09-20",
              "signature": "SigSynth20Runner",
              "mint": "MintSynth20Runner",
              "evaluate_label": "runner",
              "fill_sim_status": "documented_model_only",
              "reasons": []
            }
          ]
        }
      },
      {
        "day": "2026-09-21",
        "jsonl_name": "observe-2026-09-21.jsonl",
        "source_rows": [
          {
            "schema_version": "observe_hot_v0",
            "type": "ingest_hot",
            "t_ws": "2026-09-21T15:04:00.000+00:00",
            "t_event": null,
            "stream": "subscribeNewToken",
            "source": "pumpportal_ws",
            "commitment": "processed",
            "stage": "bonding",
            "regime_id": "env=mainnet|source=pumpportal_ws|stream=subscribeNewToken|stage=bonding|quote=wsol_assumed|commitment=processed|venue=pump_program|instr=pending_rpc|fee=unverified|market=bonding_curve",
            "txType": "create",
            "signature": "SigSynth21Runner",
            "mint": "MintSynth21Runner",
            "knowable_at_t": {
              "quote": "wsol_assumed",
              "quote_verified": false,
              "instr": "pending_rpc",
              "fee": "unverified",
              "venue": "pump_program",
              "venue_verified": false,
              "creator_verified": false,
              "reserves_source": "ws"
            },
            "ws_payload": {
              "signature": "SigSynth21Runner",
              "mint": "MintSynth21Runner",
              "txType": "create",
              "traderPublicKey": "TraderSynth21",
              "initialBuy": 2.0,
              "solAmount": 0.02
            },
            "ws_fields_unknown": [],
            "traderPublicKey": "TraderSynth21",
            "name": "Synth21",
            "symbol": "S21",
            "uri": "https://example.invalid/synth21.json",
            "bondingCurveKey": "CurveSynth21",
            "initialBuy": 2.0,
            "solAmount": 0.02,
            "vTokensInBondingCurve": 1000000.0,
            "vSolInBondingCurve": 30.0,
            "marketCapSol": 30.0
          },
          {
            "schema_version": "observe_hot_v0",
            "type": "ingest_hot",
            "t_ws": "2026-09-21T15:04:01.000+00:00",
            "t_event": null,
            "stream": "subscribeNewToken",
            "source": "pumpportal_ws",
            "commitment": "processed",
            "stage": "bonding",
            "regime_id": "env=mainnet|source=pumpportal_ws|stream=subscribeNewToken|stage=bonding|quote=wsol_assumed|commitment=processed|venue=pump_program|instr=pending_rpc|fee=unverified|market=bonding_curve",
            "txType": "create",
            "signature": "UNK",
            "mint": "MintSynth21Reject",
            "knowable_at_t": {
              "quote": "wsol_assumed",
              "quote_verified": false,
              "instr": "pending_rpc",
              "fee": "unverified",
              "venue": "pump_program",
              "venue_verified": false,
              "creator_verified": false,
              "reserves_source": "ws"
            },
            "ws_payload": {
              "signature": "UNK",
              "mint": "MintSynth21Reject",
              "txType": "create"
            },
            "ws_fields_unknown": [],
            "traderPublicKey": null,
            "name": null,
            "symbol": null,
            "uri": null,
            "bondingCurveKey": null,
            "initialBuy": null,
            "solAmount": null,
            "vTokensInBondingCurve": null,
            "vSolInBondingCurve": null,
            "marketCapSol": null
          },
          {
            "schema_version": "observe_hot_v0",
            "type": "ingest_hot",
            "t_ws": "2026-09-21T18:00:00.000+00:00",
            "t_event": null,
            "stream": "subscribeMigration",
            "source": "pumpportal_ws",
            "commitment": "processed",
            "stage": "migrating",
            "regime_id": "env=mainnet|source=pumpportal_ws|stream=subscribeMigration|stage=migrating|quote=wsol_assumed|commitment=processed|venue=pump_program|instr=pending_rpc|fee=unverified|market=pumpswap_pending",
            "txType": "migrate",